{
  "$schema": "https://json-schema.org/draft/2020-12/schema",
  "$id": "https://dura.app/standards/lflrs/schema.json",
  "title": "DURA Learner Record — LFLRS-1.0 Canonical Wire Format",
  "description": "The canonical, portable shape of a DURA learner record. This is the WIRE / EXPORT / SYNC format, not the in-browser storage shape. DURA's IndexedDB stores records in a compact internal shape (camelCase, epoch ms, string-enum ratings); projection functions in src/lib/learner-record/types.ts convert between stored and canonical at every external boundary (Supabase sync, learner export, xAPI emission). Per ADR — keeping the storage shape stable while making the wire format LFLRS-1.0 conformant avoids a destructive live-data migration. CRDT semantics are enforced by the merge code in src/lib/supabase/sync.ts (G-Set for review_log, LWW-Register for cards/mastery), not by per-record tags — adding _crdt fields to every record bloats storage with no behavioral value.",
  "type": "object",
  "required": [
    "learner_id",
    "exported_at",
    "schema_version",
    "cards",
    "review_log",
    "mastery_records"
  ],
  "additionalProperties": false,
  "properties": {
    "schema_version": {
      "type": "string",
      "const": "lflrs-1.0",
      "description": "Pinned to the LFLRS standard version this record conforms to."
    },
    "learner_id": {
      "type": "string",
      "format": "uuid",
      "description": "Local anonymous UUID. NEVER an email, name, or Supabase auth UID. Generated once at first launch and stored client-side."
    },
    "exported_at": {
      "type": "string",
      "format": "date-time",
      "description": "ISO-8601 timestamp of when this canonical record was assembled."
    },
    "cards": {
      "type": "array",
      "description": "FSRS cards. CRDT type: LWW-Register per field — sync merges field-by-field by latest _last_modified, never object-replaces. Enforced by mergeCard() in src/lib/supabase/sync.ts.",
      "items": { "$ref": "#/$defs/Card" }
    },
    "review_log": {
      "type": "array",
      "description": "FSRS review history. CRDT type: G-Set (grow-only set) — entries are append-only. Once written, a review log entry is never updated or deleted. Enforced by mergeReviewLog() in src/lib/supabase/sync.ts.",
      "items": { "$ref": "#/$defs/ReviewLogEntry" }
    },
    "mastery_records": {
      "type": "array",
      "description": "Module-level mastery transitions. CRDT type: LWW-Register per field, with the additional invariant that mastery_score is monotonically increasing — a sync that would lower a learner's mastery_score is rejected. Enforced by mergeMastery() in src/lib/supabase/sync.ts.",
      "items": { "$ref": "#/$defs/MasteryRecord" }
    }
  },
  "$defs": {
    "FSRSState": {
      "type": "string",
      "enum": ["New", "Learning", "Review", "Relearning"],
      "description": "FSRS-5 card lifecycle state. Canonical TitleCase. DURA's internal storage uses lowercase; projection capitalizes."
    },
    "Card": {
      "type": "object",
      "required": [
        "id",
        "stability",
        "difficulty",
        "due",
        "reps",
        "lapses",
        "state",
        "last_modified"
      ],
      "additionalProperties": false,
      "properties": {
        "id": { "type": "string", "format": "uuid" },
        "stability": { "type": "number", "minimum": 0 },
        "difficulty": { "type": "number", "minimum": 1, "maximum": 10 },
        "due": { "type": "string", "format": "date-time" },
        "reps": { "type": "integer", "minimum": 0 },
        "lapses": { "type": "integer", "minimum": 0 },
        "state": { "$ref": "#/$defs/FSRSState" },
        "last_modified": {
          "type": "string",
          "format": "date-time",
          "description": "Timestamp used as the LWW-Register tiebreaker during sync merge."
        }
      }
    },
    "ReviewLogEntry": {
      "type": "object",
      "required": ["id", "card_id", "rating", "elapsed_days", "scheduled_days", "review", "state"],
      "additionalProperties": false,
      "description": "G-Set element — never updated, never deleted after first write. The combination of (id) is the set membership key.",
      "properties": {
        "id": { "type": "string", "format": "uuid" },
        "card_id": { "type": "string", "format": "uuid" },
        "rating": {
          "type": "integer",
          "minimum": 1,
          "maximum": 4,
          "description": "1=again, 2=hard, 3=good, 4=easy. Canonical integer form. DURA's internal storage uses string enum; projection maps."
        },
        "elapsed_days": { "type": "number" },
        "scheduled_days": { "type": "number" },
        "review": { "type": "string", "format": "date-time" },
        "state": { "$ref": "#/$defs/FSRSState" }
      }
    },
    "MasteryRecord": {
      "type": "object",
      "required": ["module_id", "mastery_score", "last_modified"],
      "additionalProperties": false,
      "properties": {
        "module_id": { "type": "string" },
        "mastery_score": {
          "type": "number",
          "minimum": 0,
          "maximum": 1,
          "description": "0..1 fraction. Monotonically increasing — sync rejects merges that would lower this value."
        },
        "unlocked_at": {
          "type": ["string", "null"],
          "format": "date-time",
          "description": "First time mastery_score crossed the unlock threshold; null until threshold reached."
        },
        "last_modified": {
          "type": "string",
          "format": "date-time",
          "description": "LWW-Register tiebreaker."
        }
      }
    }
  }
}
