{
  "schema_version": "lflrs-1.0",
  "learner_id": "11111111-2222-4333-8444-555555555555",
  "exported_at": "2026-04-25T00:00:00.000Z",
  "cards": [
    {
      "id": "9f8a4ab2-7d8e-4e7a-9b1c-1a2b3c4d5e6f",
      "stability": 12.5,
      "difficulty": 4.2,
      "due": "2026-05-06T13:33:20.000Z",
      "reps": 3,
      "lapses": 0,
      "state": "Review",
      "last_modified": "2026-04-25T00:00:00.000Z"
    }
  ],
  "review_log": [
    {
      "id": "1a2b3c4d-5e6f-7a8b-9c0d-1e2f3a4b5c6d",
      "card_id": "9f8a4ab2-7d8e-4e7a-9b1c-1a2b3c4d5e6f",
      "rating": 3,
      "elapsed_days": 0.5,
      "scheduled_days": 11.5,
      "review": "2026-04-25T00:00:00.000Z",
      "state": "Review"
    }
  ],
  "mastery_records": [
    {
      "module_id": "phase-0/intro",
      "mastery_score": 0.85,
      "unlocked_at": "2026-04-25T00:00:00.000Z",
      "last_modified": "2026-04-25T00:00:00.000Z"
    }
  ]
}
